{
  "id": "4778",
  "source": "windows_security",
  "priority": "P3",
  "applicable_version": "Windows Server 2008 and later where the audit subcategory is enabled",
  "last_reviewed": "2026-07-22",
  "category": "Logon",
  "name": "A session was reconnected to a Window Station",
  "definition": "Windows Security Event ID 4778 records reconnection to an existing Terminal Services, Fast User Switching, or Hyper-V Enhanced Session desktop session.",
  "trigger_scenarios": "Microsoft documents that this event is generated when a user reconnects to an existing Terminal Services session or switches to an existing desktop.",
  "key_fields": [
    {
      "field": "Account Name / Account Domain / Logon ID",
      "explanation": "The user and hexadecimal session identifier associated with the reconnect."
    },
    {
      "field": "Session Name",
      "explanation": "The terminal session name such as RDP-Tcp#0."
    },
    {
      "field": "Client Name / Client Address",
      "explanation": "The reconnecting endpoint. Client Address is the concrete source for RDP session-return investigation."
    }
  ],
  "false_positives": [
    "Normal RDP reconnects after network interruption or user lock/unlock activity.",
    "Hyper-V Enhanced Session reconnects can generate the same event."
  ],
  "related_event_ids": [
    "4624",
    "4779",
    "4648"
  ],
  "attck_mapping": [
    {
      "tactic_id": "TA0008",
      "tactic_name": "Lateral Movement",
      "technique_id": "T1021.001",
      "technique_name": "Remote Services: Remote Desktop Protocol",
      "source_url": "https://attack.mitre.org/techniques/T1021/001/"
    }
  ],
  "detection_notes": "Alert when Client Address is a new external or VPN source for a privileged Account Name and Session Name is RDP-Tcp#0 or another RDP session. Microsoft documents Client Address and Session Name for 4778; reconnecting to an existing session can let T1021.001 Remote Desktop Protocol activity resume without a fresh interactive 4624 Type 10 pattern. Correlate Logon ID with 4624, 4779, and command execution after reconnection.",
  "kql_snippet": "SecurityEvent\n| where EventID == 4778\n| project TimeGenerated, Computer, Account, SessionName, ClientAddress, LogonID",
  "spl_snippet": "index=wineventlog EventCode=4778 | table _time, host, Account_Name, Session_Name, Client_Address, Logon_ID",
  "sample_log": "EventID: 4778\nAccount Name: admin\nAccount Domain: CORP\nLogon ID: 0x169e9\nSession Name: RDP-Tcp#0\nClient Name: LAPTOP42\nClient Address: 10.42.42.211",
  "source_url": "https://learn.microsoft.com/en-us/previous-versions/windows/it-pro/windows-10/security/threat-protection/auditing/event-4778",
  "technical_metadata": {
    "provider": "Microsoft-Windows-Security-Auditing",
    "channel": "Security",
    "level": "Information",
    "audit_keyword": "Audit Success"
  },
  "queries": [
    {
      "language": "kql",
      "title": "Retrieve Windows Security Event ID 4778",
      "query": "SecurityEvent\n| where EventID == 4778\n| project TimeGenerated, Computer, EventID, RenderedDescription\n| order by TimeGenerated desc",
      "data_source": "Microsoft Sentinel SecurityEvent table",
      "assumptions": [
        "The Windows Security Events connector populates SecurityEvent.",
        "Map raw XML fields to the event-specific fields described on this page."
      ],
      "source_url": "https://learn.microsoft.com/en-us/azure/azure-monitor/reference/tables/securityevent"
    },
    {
      "language": "spl",
      "title": "Retrieve Windows Security Event ID 4778",
      "query": "index=wineventlog source=\"WinEventLog:Security\" EventCode=4778\n| table _time, host, EventCode, Message",
      "data_source": "Splunk Windows Security event data",
      "assumptions": [
        "Index, source, and parsed field names vary by deployment.",
        "Apply the documented field conditions after validating local field extraction."
      ]
    },
    {
      "language": "xql",
      "title": "Retrieve Windows Security Event ID 4778",
      "query": "dataset = microsoft_windows_raw\n| filter edr_event_id = 4778",
      "data_source": "Cortex XDR microsoft_windows_raw",
      "assumptions": [
        "The Windows Security channel is ingested into Cortex XDR.",
        "Inspect raw provider fields because parsed names vary by collection path."
      ],
      "source_url": "https://docs-cortex.paloaltonetworks.com/r/Cortex-XDR/Cortex-XDR-5.x-Documentation/XDR-Collector-datasets"
    },
    {
      "language": "sigma",
      "title": "Windows Security Event ID 4778",
      "query": "title: Windows Security Event ID 4778\nstatus: experimental\nlogsource:\n    product: windows\n    service: security\ndetection:\n    selection:\n        EventID: 4778\n    condition: selection\nfalsepositives:\n    - Legitimate administrative or system activity\nlevel: informational",
      "data_source": "Sigma Windows Security log source",
      "assumptions": [
        "This rule retrieves the event and is not a standalone malicious-behavior detection.",
        "Add the event-specific conditions and correlations documented on this page."
      ],
      "source_url": "https://github.com/SigmaHQ/sigma-specification/blob/main/specification/sigma-rules-specification.md"
    }
  ],
  "value_references": [
    {
      "field": "SessionName",
      "value": "RDP-Tcp#0",
      "meaning": "An example Remote Desktop session name in the Microsoft event reference.",
      "security_relevance": "Interpret SessionName with the other documented fields and correlated events; this value alone is not proof of compromise.",
      "source_url": "https://learn.microsoft.com/en-us/previous-versions/windows/it-pro/windows-10/security/threat-protection/auditing/event-4778"
    },
    {
      "field": "ClientAddress",
      "value": "network address",
      "meaning": "The source address from which the existing session was reconnected.",
      "security_relevance": "Interpret ClientAddress with the other documented fields and correlated events; this value alone is not proof of compromise.",
      "source_url": "https://learn.microsoft.com/en-us/previous-versions/windows/it-pro/windows-10/security/threat-protection/auditing/event-4778"
    }
  ],
  "faqs": [
    {
      "question": "What does Windows Event ID 4778 mean?",
      "answer": "A user reconnected to an existing Window Station session."
    },
    {
      "question": "Does Event ID 4778 always indicate malicious activity?",
      "answer": "No. Normal RDP and Fast User Switching activity can generate it."
    },
    {
      "question": "How should Event ID 4778 be investigated?",
      "answer": "Review AccountName, SessionName, ClientAddress, and LogonId, then correlate with 4624 and 4779."
    }
  ],
  "sources": [
    {
      "title": "4778: A session was reconnected to a Window Station",
      "url": "https://learn.microsoft.com/en-us/previous-versions/windows/it-pro/windows-10/security/threat-protection/auditing/event-4778",
      "publisher": "Microsoft",
      "source_type": "vendor"
    },
    {
      "title": "Remote Services: Remote Desktop Protocol (T1021.001)",
      "url": "https://attack.mitre.org/techniques/T1021/001/",
      "publisher": "MITRE ATT&CK",
      "source_type": "attack"
    },
    {
      "title": "XDR Collector datasets",
      "url": "https://docs-cortex.paloaltonetworks.com/r/Cortex-XDR/Cortex-XDR-5.x-Documentation/XDR-Collector-datasets",
      "publisher": "Palo Alto Networks",
      "source_type": "vendor"
    },
    {
      "title": "Sigma Rules Specification",
      "url": "https://github.com/SigmaHQ/sigma-specification/blob/main/specification/sigma-rules-specification.md",
      "publisher": "SigmaHQ",
      "source_type": "detection-rule"
    }
  ]
}
