{
    "id":  "4780",
    "source":  "windows_security",
    "category":  "ObjectAccess",
    "name":  "ACL was set on accounts in administrators groups",
    "priority":  "P2",
    "applicable_version":  "Windows Server 2008 R2 and later",
    "last_reviewed":  "2026-07-13",
    "definition":  "Windows Security Event ID 4780 records ACL was set on accounts in administrators groups.",
    "trigger_scenarios":  "Windows logs the event when the audited security operation occurs.",
    "key_fields":  [
                       {
                           "field":  "Primary field",
                           "explanation":  "Object Name naming an administrators group and an Access Mask granting WRITE_DAC (0x40000) or WRITE_OWNER (0x80000) is delegated privilege persistence."
                       },
                       {
                           "field":  "Subject / Logon ID",
                           "explanation":  "The initiating account and Logon ID support attribution and correlation to 4624 and 4688."
                       },
                       {
                           "field":  "Computer",
                           "explanation":  "The affected host determines the operational impact."
                       }
                   ],
    "false_positives":  [
                            "Documented maintenance, policy changes, or approved administration can generate this event.",
                            "Validate change control and host role before suppressing."
                        ],
    "related_event_ids":  [
                              "4624",
                              "4688"
                          ],
    "attck_mapping":  [
                          {
                              "technique_id":  "T1098",
                              "technique_name":  "Account Manipulation"
                          }
                      ],
    "detection_notes":  "Object Name naming an administrators group and an Access Mask granting WRITE_DAC (0x40000) or WRITE_OWNER (0x80000) is delegated privilege persistence. This is a T1098 Account Manipulation signal; preserve the concrete value and correlate the actor, process, and related events.",
    "kql_snippet":  "SecurityEvent\n| where EventID == 4780\n| project TimeGenerated, Computer, Account",
    "spl_snippet":  "index=wineventlog EventCode=4780 | table _time, host",
    "sample_log":  "EventID: 4780\nComputer: HOST01\nSubject: CORP\\\\admin.ops",
    "source_url":  "https://learn.microsoft.com/en-us/windows/security/threat-protection/auditing/event-4780"
}
