{
  "source": "windows_security",
  "last_reviewed": "2026-07-22",
  "id": "4713",
  "category": "Policy",
  "name": "Kerberos policy was changed",
  "priority": "P3",
  "applicable_version": "Windows Server 2008 and later",
  "definition": "Windows Security Event ID 4713 records a Kerberos policy change on a domain controller.",
  "trigger_scenarios": "The event is generated only on domain controllers when Kerberos policy values are changed through domain policy.",
  "key_fields": [
    {
      "field": "KerberosPolicyChange",
      "explanation": "The field lists changed parameters as Parameter_Name: new_value (old_value). Microsoft documents KerMaxT, KerMaxR, KerMinT, KerProxy, and KerOpts."
    },
    {
      "field": "KerOpts",
      "explanation": "Enforce user logon restrictions. Microsoft documents 0x80 as Enabled and 0x0 as Disabled; disabling it weakens Kerberos logon restriction enforcement."
    },
    {
      "field": "Subject",
      "explanation": "The account that made the change. Validate whether it is an approved domain-policy administrator and whether the change was scheduled."
    }
  ],
  "false_positives": [
    "Planned domain hardening, Kerberos lifetime tuning, or Group Policy maintenance can legitimately generate 4713.",
    "Domain controller promotion or baseline rebuilds may reapply Kerberos policy values."
  ],
  "related_event_ids": [
    "4719",
    "4768",
    "4769"
  ],
  "attck_mapping": [
    {
      "tactic_id": "TA0112",
      "tactic_name": "Defense Impairment",
      "technique_id": "T1484.001",
      "technique_name": "Domain or Tenant Policy Modification: Group Policy Modification",
      "source_url": "https://attack.mitre.org/techniques/T1484/001/"
    }
  ],
  "detection_notes": "Alert on unplanned 4713 where KerberosPolicyChange sets KerOpts to 0x0, because Microsoft documents 0x80 as Enforce user logon restrictions enabled and 0x0 as disabled. That is a concrete T1484.001 signal: a domain Kerberos policy change weakens centrally managed authentication behavior. Also review large KerMaxT or KerMaxR increases because Microsoft documents the conversion formulas for ticket and renewal lifetime; correlate the Subject Logon ID to 4624 and administrative change tickets.",
  "kql_snippet": "SecurityEvent\n| where EventID == 4713\n| project TimeGenerated, Computer, SubjectUserName, SubjectLogonId, KerberosPolicyChange",
  "spl_snippet": "index=wineventlog EventCode=4713\n| table _time, host, SubjectUserName, SubjectLogonId, KerberosPolicyChange",
  "sample_log": "Subject: CORP\\admin.ops\nLogon ID: 0x3e7\nKerberosPolicyChange: KerOpts: 0x0 (0x80); KerMaxT: 0x10c388d000 (0x861c46800);",
  "source_url": "https://learn.microsoft.com/en-us/previous-versions/windows/it-pro/windows-10/security/threat-protection/auditing/event-4713",
  "technical_metadata": {
    "provider": "Microsoft-Windows-Security-Auditing",
    "channel": "Security",
    "level": "Information"
  },
  "queries": [
    {
      "language": "kql",
      "title": "Retrieve Windows Security Event ID 4713",
      "query": "SecurityEvent\n| where EventID == 4713\n| project TimeGenerated, Computer, Account, EventData\n| order by TimeGenerated desc",
      "data_source": "Microsoft Sentinel SecurityEvent table",
      "assumptions": [
        "The Windows Security Events connector populates SecurityEvent.",
        "Map raw XML fields to the event-specific fields documented on this page."
      ],
      "source_url": "https://learn.microsoft.com/en-us/azure/azure-monitor/reference/tables/securityevent"
    },
    {
      "language": "spl",
      "title": "Retrieve Windows Security Event ID 4713",
      "query": "index=wineventlog source=\"WinEventLog:Security\" EventCode=4713\n| table _time, host, user, EventCode, Message",
      "data_source": "Splunk Windows Security event data",
      "assumptions": [
        "Index, source and field aliases vary by deployment.",
        "Apply event-specific field conditions after validating local extraction."
      ]
    },
    {
      "language": "xql",
      "title": "Retrieve Windows Security Event ID 4713",
      "query": "dataset = microsoft_windows_raw\n| filter edr_event_id = 4713",
      "data_source": "Cortex XDR microsoft_windows_raw",
      "assumptions": [
        "The applicable Windows event channel is ingested into Cortex XDR.",
        "Inspect raw provider fields because parsed names vary by collection path."
      ],
      "source_url": "https://docs-cortex.paloaltonetworks.com/r/Cortex-XDR/Cortex-XDR-5.x-Documentation/XDR-Collector-datasets"
    },
    {
      "language": "sigma",
      "title": "Windows Security Event ID 4713",
      "query": "title: Windows Security Event ID 4713\nstatus: experimental\nlogsource:\n    product: windows\n    service: security\ndetection:\n    selection:\n        EventID: 4713\n    condition: selection\nfalsepositives:\n    - Legitimate administrative or system activity\nlevel: informational",
      "data_source": "Sigma Windows Security log source",
      "assumptions": [
        "This rule retrieves the event and is not a standalone malicious-behavior detection.",
        "Add the documented conditions and correlations in the destination SIEM."
      ],
      "source_url": "https://github.com/SigmaHQ/sigma-specification/blob/main/specification/sigma-rules-specification.md"
    }
  ],
  "value_references": [
    {
      "field": "KerOpts",
      "value": "0x80",
      "meaning": "Microsoft documents this value as Enforce user logon restrictions enabled.",
      "security_relevance": "Interpret KerOpts with the complete event and correlated activity; this value alone is not proof of compromise.",
      "source_url": "https://learn.microsoft.com/en-us/previous-versions/windows/it-pro/windows-10/security/threat-protection/auditing/event-4713"
    },
    {
      "field": "KerOpts",
      "value": "0x0",
      "meaning": "Microsoft documents this value as Enforce user logon restrictions disabled.",
      "security_relevance": "Interpret KerOpts with the complete event and correlated activity; this value alone is not proof of compromise.",
      "source_url": "https://learn.microsoft.com/en-us/previous-versions/windows/it-pro/windows-10/security/threat-protection/auditing/event-4713"
    }
  ],
  "faqs": [
    {
      "question": "What does Windows Event ID 4713 mean?",
      "answer": "Kerberos policy for the domain was changed."
    },
    {
      "question": "Does Event ID 4713 always indicate malicious activity?",
      "answer": "No. Authorized domain policy administration can generate it."
    },
    {
      "question": "How should Event ID 4713 be investigated?",
      "answer": "Compare old and new policy values, identify the subject logon, and validate the responsible GPO and change record."
    }
  ],
  "sources": [
    {
      "title": "4713: Kerberos policy was changed",
      "url": "https://learn.microsoft.com/en-us/previous-versions/windows/it-pro/windows-10/security/threat-protection/auditing/event-4713",
      "publisher": "Microsoft",
      "source_type": "vendor"
    },
    {
      "title": "Domain or Tenant Policy Modification: Group Policy Modification (T1484.001)",
      "url": "https://attack.mitre.org/techniques/T1484/001/",
      "publisher": "MITRE ATT&CK",
      "source_type": "attack"
    },
    {
      "title": "XDR Collector datasets",
      "url": "https://docs-cortex.paloaltonetworks.com/r/Cortex-XDR/Cortex-XDR-5.x-Documentation/XDR-Collector-datasets",
      "publisher": "Palo Alto Networks",
      "source_type": "vendor"
    },
    {
      "title": "Sigma Rules Specification",
      "url": "https://github.com/SigmaHQ/sigma-specification/blob/main/specification/sigma-rules-specification.md",
      "publisher": "SigmaHQ",
      "source_type": "detection-rule"
    }
  ]
}
