{
  "source": "windows_security",
  "last_reviewed": "2026-07-22",
  "id": "4675",
  "category": "Kerberos",
  "name": "SIDs were filtered",
  "priority": "P3",
  "applicable_version": "Windows Server 2008 and later",
  "definition": "Windows Security Event ID 4675 records that SIDs were filtered for an Active Directory trust.",
  "trigger_scenarios": "The event is generated on a domain controller when SID filtering is applied for a specific trust and SIDs are removed from the authorization data.",
  "key_fields": [
    {
      "field": "Filtered SIDs",
      "explanation": "The SIDs removed by trust filtering. Unexpected privileged-domain SIDs in this field show that the trust boundary blocked attempted privilege projection."
    },
    {
      "field": "Trust Direction / Trust Attributes / Trust Type",
      "explanation": "Trust metadata that identifies which relationship performed the filtering. Use it to determine whether the event belongs to an external, forest, or other configured trust."
    },
    {
      "field": "TDO Domain SID",
      "explanation": "The trusted-domain object domain SID. It anchors the filtered SID list to the trust relationship being evaluated."
    }
  ],
  "false_positives": [
    "Normal SID filtering can occur on configured external or forest trusts and may simply confirm the trust boundary is working.",
    "Trust migrations and domain consolidation projects can produce expected filtering events."
  ],
  "related_event_ids": [
    "4765",
    "4766",
    "4716"
  ],
  "attck_mapping": [
    {
      "tactic_id": "TA0004",
      "tactic_name": "Privilege Escalation",
      "technique_id": "T1134.005",
      "technique_name": "Access Token Manipulation: SID-History Injection",
      "source_url": "https://attack.mitre.org/techniques/T1134/005/"
    }
  ],
  "detection_notes": "Use threshold=1 for 4675 on high-value trusts because the event is already the domain controller reporting that SIDs were filtered. It supports T1134.005 triage when Filtered SIDs contains privileged or foreign-domain SIDHistory values, since SID-History Injection attempts to project extra SIDs into the token and trust SID filtering removes them. Correlate the same trust to recent 4765 or 4766 SID History changes and 4716 trust modifications before treating the event as malicious rather than expected boundary enforcement.",
  "kql_snippet": "SecurityEvent\n| where EventID == 4675\n| project TimeGenerated, Computer, TargetUserName, TargetDomainName, TrustDirection, TrustAttributes, TrustType, FilteredSids",
  "spl_snippet": "index=wineventlog EventCode=4675\n| table _time, host, TargetUserName, TargetDomainName, TrustDirection, TrustAttributes, TrustType, FilteredSids",
  "sample_log": "Target Account:\n  Account Name: alice\nTrust Information:\n  Trust Direction: Inbound\n  Trust Attributes: FOREST_TRANSITIVE\n  Trust Type: Forest\n  TDO Domain SID: S-1-5-21-1000-2000-3000\n  Filtered SIDs: S-1-5-21-4000-5000-6000-512",
  "source_url": "https://learn.microsoft.com/en-us/previous-versions/windows/it-pro/windows-10/security/threat-protection/auditing/event-4675",
  "technical_metadata": {
    "provider": "Microsoft-Windows-Security-Auditing",
    "channel": "Security",
    "level": "Information"
  },
  "queries": [
    {
      "language": "kql",
      "title": "Retrieve Windows Security Event ID 4675",
      "query": "SecurityEvent\n| where EventID == 4675\n| project TimeGenerated, Computer, Account, EventData\n| order by TimeGenerated desc",
      "data_source": "Microsoft Sentinel SecurityEvent table",
      "assumptions": [
        "The Windows Security Events connector populates SecurityEvent.",
        "Map raw XML fields to the event-specific fields documented on this page."
      ],
      "source_url": "https://learn.microsoft.com/en-us/azure/azure-monitor/reference/tables/securityevent"
    },
    {
      "language": "spl",
      "title": "Retrieve Windows Security Event ID 4675",
      "query": "index=wineventlog source=\"WinEventLog:Security\" EventCode=4675\n| table _time, host, user, EventCode, Message",
      "data_source": "Splunk Windows Security event data",
      "assumptions": [
        "Index, source and field aliases vary by deployment.",
        "Apply event-specific field conditions after validating local extraction."
      ]
    },
    {
      "language": "xql",
      "title": "Retrieve Windows Security Event ID 4675",
      "query": "dataset = microsoft_windows_raw\n| filter edr_event_id = 4675",
      "data_source": "Cortex XDR microsoft_windows_raw",
      "assumptions": [
        "The applicable Windows event channel is ingested into Cortex XDR.",
        "Inspect raw provider fields because parsed names vary by collection path."
      ],
      "source_url": "https://docs-cortex.paloaltonetworks.com/r/Cortex-XDR/Cortex-XDR-5.x-Documentation/XDR-Collector-datasets"
    },
    {
      "language": "sigma",
      "title": "Windows Security Event ID 4675",
      "query": "title: Windows Security Event ID 4675\nstatus: experimental\nlogsource:\n    product: windows\n    service: security\ndetection:\n    selection:\n        EventID: 4675\n    condition: selection\nfalsepositives:\n    - Legitimate administrative or system activity\nlevel: informational",
      "data_source": "Sigma Windows Security log source",
      "assumptions": [
        "This rule retrieves the event and is not a standalone malicious-behavior detection.",
        "Add the documented conditions and correlations in the destination SIEM."
      ],
      "source_url": "https://github.com/SigmaHQ/sigma-specification/blob/main/specification/sigma-rules-specification.md"
    }
  ],
  "value_references": [
    {
      "field": "EventID",
      "value": "4675",
      "meaning": "Windows filtered SIDs during logon processing.",
      "security_relevance": "Interpret EventID with the complete event and correlated activity; this value alone is not proof of compromise.",
      "source_url": "https://learn.microsoft.com/en-us/previous-versions/windows/it-pro/windows-10/security/threat-protection/auditing/event-4675"
    },
    {
      "field": "FilteredSids",
      "value": "SID list",
      "meaning": "The SIDs removed by trust filtering and the primary value for determining risk.",
      "security_relevance": "Interpret FilteredSids with the complete event and correlated activity; this value alone is not proof of compromise.",
      "source_url": "https://learn.microsoft.com/en-us/previous-versions/windows/it-pro/windows-10/security/threat-protection/auditing/event-4675"
    }
  ],
  "faqs": [
    {
      "question": "What does Windows Event ID 4675 mean?",
      "answer": "Windows filtered one or more SIDs during authentication across a trust boundary."
    },
    {
      "question": "Does Event ID 4675 always indicate malicious activity?",
      "answer": "No. SID filtering is a security control and may block expected legacy SIDHistory values."
    },
    {
      "question": "How should Event ID 4675 be investigated?",
      "answer": "Review FilteredSids and trust attributes and correlate with SIDHistory and trust-change events."
    }
  ],
  "sources": [
    {
      "title": "4675: SIDs were filtered",
      "url": "https://learn.microsoft.com/en-us/previous-versions/windows/it-pro/windows-10/security/threat-protection/auditing/event-4675",
      "publisher": "Microsoft",
      "source_type": "vendor"
    },
    {
      "title": "Access Token Manipulation: SID-History Injection (T1134.005)",
      "url": "https://attack.mitre.org/techniques/T1134/005/",
      "publisher": "MITRE ATT&CK",
      "source_type": "attack"
    },
    {
      "title": "XDR Collector datasets",
      "url": "https://docs-cortex.paloaltonetworks.com/r/Cortex-XDR/Cortex-XDR-5.x-Documentation/XDR-Collector-datasets",
      "publisher": "Palo Alto Networks",
      "source_type": "vendor"
    },
    {
      "title": "Sigma Rules Specification",
      "url": "https://github.com/SigmaHQ/sigma-specification/blob/main/specification/sigma-rules-specification.md",
      "publisher": "SigmaHQ",
      "source_type": "detection-rule"
    }
  ]
}
